{"schemaVersion":1,"workPackage":"WP-TXN-REAL-01","validations":["VAL-TXN-004","VAL-TXN-005"],"status":"passed","startedAtUtc":"2026-08-06T13:45:18.100Z","completedAtUtc":"2026-08-06T13:45:42.056Z","durationMs":23956,"authorizationMatrix":{"adminPrimary":"allowed","adminSecondary":"allowed","viewer":"allowed","unknownRole":"forbidden","missingToken":"unauthenticated","malformedToken":"unauthenticated","serviceToken":"unauthenticated"},"precisionMatrix":{"amountExact":true,"amountGtExact":true,"amountLtExact":true,"gatewayAmountExact":true,"jsonNumberOnly":true,"mapperValuesUnmodified":true},"requestCounts":{"transaction":7,"adapter":6,"gateway":1,"serviceSearch":4,"mapperCountUpTo":4,"mapperQuery":0,"otherServiceMethods":0,"otherTransactionEndpoints":0,"model":0},"responseVisibility":"provider_contract_and_empty_live_response","logSafety":{"logLeakCount":0,"rawLogsDeleted":true,"transactionValuePersisted":false,"jwtPersisted":false,"hmacKeyPersisted":false,"bodyPersisted":false,"principalPersisted":false},"runtimeIsolation":{"authService":"isolated_local","transactionService":"spring_boot_test_netty","gatewayService":"actual_jar_formal_mq_route","databaseAccessed":false,"permanentRouteUsed":true,"deepSeekCalled":false}}